Id,urls,text,language
8 Heitast og saltast vestanfyri HAVGRANSKING: vasti parturin av Atlantssjógvinum kólnar meiri enn eitt hálvt stig á síni leið gjøgnum føroyskt sjóøki. Eisini verður sjógvurin feskari á ferðini. Høvuðsatvoldin eru kuldi og avfall úr luftini. Hetta vísa kanningar hjá Havstovuni av teirri týdningarmiklu og natúrligu køliskipanini í føroyskum havøki. Karin M.H. Larsen havfrøðingur m m m m m > 3000 m Standardskurður Íslandsryggurin Banka rennan Føroya Banki Í ovaru løgunum t.v.s. frá vatnskorp u ni og niður á umleið 500 m dýpi í Atlantshavi er lutfals liga heitur og saltur sjógvur. Hesin sjógvur verður førdur við norðuratlantiska rákinum úr Hetlands rennan Hetland Mynd 1. Havleiðirnar kring Føroyar. Svørtu linjurnar eru teir 4 standardskurðirnir, har Havstovan regluliga ger kanningar við Magnusi Heinasyni. Reyðu pílarnir vísa rákið av Atlantssjógvi í teimum ovaru løgunum. Littu rundingarnir vísa til úrslitini í Mynd 2. Norðuratlantshavi fram við Føroy um og víðari inn í Norðurhøv, Barentshav ið og Íshavið. Týðandi køliskipan Á okkara leiðum og longur norð uri er luftin oftast kaldari enn sjógv urin. g tí kølir luftin sjógvin. Um luftin megnar at køla sjógvin nóg mikið, gerst hann at enda so tung ur, at hann søkkur niður á stór dýp i. Haðani ferðast sjógv ur in so eftir botni suður aftur í Atlants hav ið og víðari til Kyrrahavið og India havið. Hendan kølingin á okkara leiðum og longur norðuri er tískil ein týdningarmikil partur í hesi ringrás. Ein ringrás, sum t.d. førir oksygen til teir djúpu partarnar av hinum heimshøvunum. Kølnar meiri enn eitt hálvt stig Kanningar, sum Havstovan byrjaði longu fyri meiri enn 20 árum síðani, vísa eitt tíðiligt rák. 8
9 10.0 a) 9.0 Hiti ( C) Sjógvurin kólnar útvið 0,8 stig og verður umleið 0,05 promillu feskari á síni leið frá økinum vestanfyri og til hann er við skurðin norðanfyri b) Saltinnihald Vestan fyri Føroyabanka og yvir Bankarennuni er sjógvurin bæði heitari og saltari enn norðan, eystan og sunnan fyri Føroyar. Sjógvurin kólnar útvið 0,8 stig og verður umleið 0,05 promillu feskari á síni leið frá økinum vestanfyri og til hann er við skurðin norðanfyri. Men hann kólnar ikki so nógv frá tí, at sjógvurin er norðanfyri og til hann er við skurðin eystanfyri. rsøkin er helst, at sjógvurin er meiri spjaddur vestanfyri í einum møkum, breiðum ráki, og tí verður nógv ávirkaður av luftini. Tá sjógvurin fer eystur um Íslandsryggin, savnast hann í einum sterkari og smalri streymi, sum hevur minni samband við luftina og tískil kólnar meira líðandi. Við skurðin sunnanfyri er rákið meiri óstøðugt, og tí er ilt at siga nakað um, hvørja leið hesin sjógvur er komin. Broytingar í Atlantssjógvinum kunnu ávirka bæði fiskastovnar og veðurlag um okkara leiðir Mynd 2. Myndin vísir ávikavist hitan og saltinnihaldið í einum 50 metra tjúkkum lagi av Atlantssjógvi á 5 ymsum støðum á standardskurðunum (støðini eru merkt við littum rundingum á Mynd 1). Ávirkar veðurlagið og fisk Atlantssjógvurin, sum rekur fram við Føroyum, hevur sera stóran týdning fyri veðurlagið á okkara leiðum. Tað er hesin sjógvur, sum ger, at vit hava lutfallsliga lýggjar vetrar í Føroyum. Harafturat hevur hesin sjógvur alstóran týdning fyri vistskipanir í havinum og er grundarlagið undir stóru pelagisku fiskastovnunum, sum ferðast gjøgnum føroyskt havøki. Tískil er av stórum týdningi at fylg ja við í broytingunum, sum hend a í havinum, so at vit kunnu meta um, hvussu hesar í fyrstu syftu ávirka fiskastovnarnar og í longdini møguliga ávirka okkara veðurlag. Kanningarnar við Føroyar Havstovan hevur síðan seint í 1980-unum regluliga gjørt kanningar av havinum kring Føroyar fyri at kanna, hvussu havumhvørvið kring okkum broytist. Hiti og saltinnihald í sjónum verða mátað fýra ferðir um árið eftir fýra standardskurðum (Mynd 1). Á øllum fýra skurðunum er Atlantssjógvur at finna í ovaru løgunum, men sjógvurin er ikki líka heitur og saltur allastaðni. 9
10 Riturnar eru í Labradorhavinum um veturin Fuglakanningarstøðin Fuglakanningarstøðin, sum hevur tikið lut í kanningunum av rituni, er eitt alment fíggjað tiltak. Skipað verður fyri eftir lits kanning um viðvíkjandi sjó fugla meingi num í Føroyum og skulu kanningarnar m.a. staðfesta sambandið millum sjófugl og fisk. Fugla kanning ar støðin er mannað við einum fuglafrøðingi í føstum starvi. 10
11 Ritubergið í Stóru Dímun, har loggararnir vórðu settir á riturnar. Bergur lsen fuglafrøðingur FUGLAFRØÐI: Í 2009 setti Fuglakanningarstøðin ljósloggarar á ritur fyri at kanna, hvar tær eru um veturin. Tá ið riturnar komu aftur á sumri 2010 sást, at tær høvdu verið í Labradorhavinum. Tá ið riturnar rýmdu úr berginum í august 2010, fóru tær beina leið vestureftir. nkur fór heilt til Baffinsland í Eysturkanada. Meginpartin av vetrinum vóru tær uttan fyri Ný Funnaland saman við ritum úr øðrum londum km heimanífrá. Kanningin er liður í einum samstarv i millum londini kring Norðuratlants havið fyri at finna fram til, hví riturnar fækkast í tali. Ein av spurn ing unum er, hvar ritur nar eru um veturin, og um tær allar eru í sama øki. Her vóru tær føroysku riturnar í desembur mánað Hvør litur umboðar eina ritu, so tær hava allar verið um somu leið. (M. Frederiksen, DMU, Århus Universitet). 11
12 Vetrarbústað í Kanada Hesi fyrstu úrslitini vísa, at 80% av ritunum í Norður atlantshavi halda til um somu leið um vetur in eystan fyri Ný Funna land í Eysturkanada. Hetta er tí eitt sera týd ning armikið øki fyri ritur nar, og um føðigrundarlagið broytist her, so verða Rógvi Mouritsen, til fiskiskap við M/S Hans Erik á Flemish Cap, februar-mai Brot úr dagbókini: 80% av ritunum í Norðuratlantshavi halda til um somu leið um veturin... Av fugli er har nógv rita frá februar, tá vit komu, og hon er har helst allan veturin, men hon rýmir í mai. Har er bæði gamal og ungur fuglur, men sum mai-mánaði nærkast, hvørvur gamla ritan. Um hálvan mai sæst bert onkur hendinga ungrita... allar ritunar í Norðurhøvum á virkaðar. Størsti trupul leikin hjá føroysku rit u num hev ur tó verið um summarið, meðan tær hava verið undir Føroyum. v lítið av føði hevur verið til pisur nar og tí eru tær deyð ar í hungri. Ferðast víða Úrslitini vísa, hvar hvør einstøk rita hevur verið allan veturin. Ein rita úr Stóru Dímun fór t.d. fyrst yvir til Kanada, har hon var í nakrar vikur. Síðan i fór hon til Ný Funnaland, har hon var allan veturin. Haðani fór hon fyrst til Írland og so til Ísland, áðrenn hon kom aftur til Føroyar í apríl mánað. So myndin er greið. Riturnar ferðast víða um. Summarið í Føroyum er størsti trupulleikin hjá føroysku ritunum Riturnar klára at finna føði til pisurnar, meðan tær eru smáar. Men tá ið pisurnar veksa, knípur við at finna nóg nógva føði, og pisurnar doyggja. Í somu reiðrum Í Føroyum sótu riturnar í somu reiðrum sum árið fyri. Men av tí at tær flestu pisurnar vóru deyðar í hungri, sótu tær gomlu riturnar ikki so fastar á reiðrunum, sum tær annars gera, tá ið tær hava pisu, og tí vóru tær ringar at fanga. Altjóða kanning Verkætlanin hevur heitið: Kanning av ferðingini hjá ritum í Norðuratlantshavi. Hon verður gjørd í samstarvi við Kanada, Grønland, Ísland, Noreg, Russland og Skotland. Mannagongdin er tann, at ein loggari verður settur á ein ring, sum síðani verður festur um beinið á rituni. Fyri at kunna lesa úrslitini, er neyðugt at fáa hendur á loggarunum aftur. g hetta eydnaðist rættiliga væl. Loggarar vóru festir á 20 ritur. Summarið eftir vóru 16 av hesum ritunum sæddar aftur í Føroyum og eydnaðist tað at fáa hendur á 10 av teimum. Loggararnir vórðu tiknir av ritunum, og síðani varð fuglurin sleptur leysur aftur. Roynt verður aftur í summar at fáa hendur á teimum seinastu loggarunum. Úrslitini eru síðani viðgjørd saman við hinum 193 loggarunum, sum eru fingnir aftur í verkætlanini aðrastaðni og ein felags vísindalig grein er skrivað. Í Føroyum hevur Innlendismálaráðið stuðlað verkætlanini fíggjarliga. 12
13 Plantuæti er lykilin VISTFRØÐI: Hægri verur í vistskipanini, so sum nebbasildayngul, toskur, hýsa og lomviga, eru týðiliga tengdar at nøgdini av plantuæti. Kirstin Eliasen PhD-lesandi Nýliga er staðfest, at nøgd og longd á nebbasildayngli eru tætt knýtt at nøgdini av plantuæti á føroyska landgrunninum. Sambandið er ikki eyðsýnt, eftirsum nebbasildayngul í sera lítlan mun etur plantuæti. Óbeinleiðis samband Nebbasild livir í høvuðsheitum av djóra æti, serstakliga kopepodum. Fyrstu tíðina eftir kleking livir nebbasildin mest av eggum og larvum frá djóraæti, men so hvørt sum hon verður størri, verða føðslu lutir nir tilsvarandi størri, og fer hon í størri og størri mun at liva av vaksnum djóraæti. Hin vegin livir djóraæti einans av plantuæti, og teirra nøring er ofta sædd at vera beinleiðis tengd at nøgdini av plantuæti. Tískil kann nøgdin av plantuæti nýtast sum eitt óbeinleiðis mát fyri, hvussu nógv nebbasildayngulin hevur til matna. Eisini toskur, hýsa og lomviga Nebbasild er týdningarmikil føði hjá nógvum fiski og sjófugli. Hetta kann vera orsøkin til, at eitt líknandi samband eisini er funnið millum nøgd av plantuæti og vøkstur og tilgongd hjá toski og hýsu. g somululeiðis er eitt samband millum nøgd av plantuæti og nøgd av lomviga á føroyska landgrunninum. Plantuæti Djóraæti Lomviga Nebbasild Toskur 13
14 Stríðið móti sandmaðki KANNINGAR: Flakafólk kenna teir væl. Sandmaðkarnar. Føroyska flakavinnan hevur í mong ár stríðst við at beina teir úr fiskinum, áðrenn hann fer víðari í framleiðsluni. Marknaðurin setir nú føroysku framleiðarunum krøv um serligar kanningarskipanir. Dánjal Petur Højgaard lívfrøðingur Marknaðurin í Europa hevur fyri kortum sett krøv til føroyskar fiskavøruframleiðarar um at útvega kanningarskipanir fyri sníkar í útfluttum fiski og fiskavørum. Sníkur er føroyska orðið fyri fiskaparasittar. Krøvini umfata bæði villan fisk og alifisk. Flestu fiska framleiðarar eru longu komnir fram til góðkendar manna gongdir fyri, hvussu útflutningsvørurnar kunnu verða kannaðar fyri fiskasníkar. Havstovan hevur verið við í hes um kanningum umvegis ein at knýttan granskara. Hesin hevur Sandmaðkur kann geva fólki bæði magailsku og ovurviðkvæmi millum annað gjørt kanningar av villum fiski við alibrúk. Illa lýddur sandmaðkur Høvuðstrupulleikin fyri nakrar markn aðir er sandmaðkur, sum er í kjøt i num á fiski. Fáa fólk hesi djór í seg í livandi líki, kann tað geva heilsutrupulleikar. Um framt búkilsku, ið er vanlig í Japan og øðrum londum, har fólk eta ráan fisk, eru serliga spansk ir granskarar komnir fram til, at sandmaðkurin Anisakis simplex kann elva til álvarsligt ovurviðkvæmi. Havstovan fylgir tí væl við á økinum og fer væntandi eisini í fram- 14
15 Sníkur (parasittur) Ein sníkur er eitt dýr, sum livir á ella í einum øðrum dýri, og sum oftast fær sína føði frá vertdýrinum, uttan at nerva vanliga lívið hjá viðkomandi stórvegis. Ein sníkur kann í ein støk um førum gera av við vertin. tíðini at lut taka í teim neyð ugu kanningun um, ið hava týdning fyri at halda fiskamarknaðin opnan fyri føroyskum fiskavørum. Heilsufrøðiliga Starvsstovan er tann myndugleikin, sum var ar av mál i num, og hon heitti á Hav stovuna um at fáa í lag kravdu kanningar nar, umframt at halda skeið fyri starvsfólki um trupulleikarnar. Her verður seiður við eitt av alibrúkunum kannaður fyri sandmaðk í innvølunum. Á myndini sæst eitt sandmaðka-hylki á livrini. Lívsringrásin hjá sandmaðki Endaverturin hjá sandmaðkinum Anisakis er hvalur. Í maganum á hvali framleiðir sandmaðkurin egg, ið fara út í sjógvin, inn í plankton, inn í fisk og síð ani aftur í hvalamagan og ring rásin er fullførd. Til tess at eftirkanna nærri rundormar í inn vølum og vøddum, verða hesi sýni sodnað í pepsin-saltsýru. Tað ger, at rundormarnir loysna, so at teir kunnu kann ast nærri. Hesa viðgerð tola nøkur rundormasløg, t.d. Anisakis. Umteknað eftir Arne Levsen 15
16 Nýggj stýrisamboð skulu tryggja varandi fiskiskap Jákup Reinert fiskifrøðingur REGULERING: Síðani 1998 hevur tann sonevnda PA-fyrivarnisreglan verið galdandi fyri vísindaligu ráðgevingina hjá Havstovuni. Nú er ein nýggj altjóða skipan ávegis. Umframt burðardygd er lyklaorðið nú at tryggja tann mest varandi fiskiskapin. Altjóða broytingar eru á veg í arbeið i num at stýra fiskiskapi og við vísindaligu ráðgevingini. Seinastu 30 árini eru nógvar altjóða samtyktir gjørdar um, hvussu fiskiskapurin kann regulerast á skilabesta hátt. g broytingarnar, sum nú fara at henda, fara at seta nýggj krøv til fiskiskapin. 13 ár við fyrivarnisregluni Eitt grundleggjandi amboð í ráð geving ini hjá Havstovuni tey seinastu 13 árini hevur verið tann sonevnda fyrivarnisreglan. Reglan um fyrivarni Precautionary Approach, stytt PA varð allýst í United Nations Straddling Fish Stocks agreement og FA Code of Conduct for Responsible Fisheries, sum báðar komu í Eftir tað tók altjóða hav - granskingarstovnurin ICES hetta am boð við í sína ráðgeving. Høvuðsendamálið við PA er at tryggja, at stovnarnir verða fiskaðir lívfrøðiliga burðardygt. Tað merkir, at forðast skal fyri, at gýtingar stovnar nir gerast so smáir, at vandi er Havgranskingarstovnurin ICES er nú í ferð við at fara frá eini PA-ráðgeving til eina sonevnda MSYráðgeving, sum stendur fyri Maximum Sustainable Yield fyri, at teir ikki megna at fram leiða góða tilgongd. Í praksis varð hetta gjørt við tveimum átøkum. Í fyrra lagi varð ásett eitt mark virði fyri gýtingarstovnar (B lim ), sum gýtingarstovnar ikki mugu fara niður um. g í seinna lagi varð á sett eitt mark virði fyri, hvussu stórur partur av gýtingarstovnunum kann veiðast um árið (veiðu trýst, F lim ), fyri at gýtingarstovnarnir ikki skulu minka nið ur um B lim. 16
17 Men stovns meting ar eru heftar av á vís ari ó vissu. Fyri at leggja upp fyri hesum, er óvissan løgd aftrat B lim, og hetta fyrivarnis mark virðið, B pa, er tað, ið nýtt verður í ráðgevingini. g á sama hátt er tað F pa, ið verður nýtt sum markvirði fyri veiðu trýst. Hesi fyrivarnis referansuvirði vórðu ásett fyri tosk, hýsu og upsa undir Føroyum í 1998, og hava verið grund ar lagið fyri ráðgevingini hjá bæði ICES og Havstovuni síðan tá. Nevnast kann, at B lim og B pa fyri hýsu vórðu endurskoðað og broytt í 2007, og fyri upsa verða tey endurskoðað og vónandi broytt í Men nú verður skipanin so broytt. Vistfrøði og MSY ICES er nú í ferð við at fara frá eini PA-ráðgeving til eina sonevnda MSY-ráðgeving, sum stendur fyri Maximum Sustainable Yield. Henda ráðgeving hevur ikki ein ans til endamáls at tryggja eina burð ardygga veiðu, men skal harumframt tryggja eina mesta, varandi veiðu. Eins og gjørt varð, tá PAráðgevingin varð sett í verk, so er broytingin til MSY eisini gjørd ið kunnu geva ta størstu varandi úrtøkuna og fiskiskapin er málið Umskiftið til eina MSY-regulering er ætlað sum ein líðandi gongd, har skipanin skal gerast virkin í fyri at lúka altjóða samtyktir. Longu á United Nations Convention on the Umskiftið til eina MSY-regulering er ætlað sum ein líðandi seinasta lagi í Nú eru bert fýra ár eftir til hetta málið. ICES hevur avgjørt at Law of the Sea í 1982 halda fast um hesa tíðarfreist í síni ráð geving. gongd, har skipanin varð ynski sett fram skal gerast virkin í um, at reguleringar av Stovn urin mælir tí til, at fiskiveiðuni skuldu seinasta lagi í 2015 veiðutrýstið beinanvegin tryggja, at sum mest fekst burtur úr stovn unum í longdini. g við Johannesburg De claration of the World Summit of Sustain able Development í 2002 varð tráðurin tikin uppaftur. Tá varð samtykt, at vistfrøðilig viðurskifti skuldu takast við í reguleringina, og at stovnarnir skuldu byggjast upp til støddir, verður regu lerað niður á F pa. Síðani skal tað ár liga veiðutrýstið so líð andi mink ast niður á F MSY í Í hesum liggur eisini, at F MSY ikki kann vera størri enn F pa, men a loftast nakað minni. Ein um legging av ráðgevingini fer sostatt at krevja at fiskiskapurin verð ur skynsamiligur í komandi árum. MSY og rætta veiðutrýstið MSY-hugtakið er víst á myndini. Myndin byggir á eitt sonevnt produktiónsmodell, har til ber at rokna eitt veiðutrýst (F MSY ), har stovnurin í longdini fer at geva ta mestu, varandi veiðuna (MSY). Ætlanin er so, at veiðutrýstið skal regulerast soleiðis, at tað í miðal verður F MSY (also eitt target virði, F target ). Reguleringin kann gerast við at áseta kvotur, t.v.s. eitt Total Allowable Catch, stytt TAC, ella á føroyskum Mest Loyvda Veiða, stytt MLV. Ella eina hóskandi veiðuorku, t.d. tal á fiskidøgum. Ørvurin vísir tað veiðutrýstið (F MSY ), sum í longd ini í miðal gevur størstu, varandi veiðuna. Veiða Veiðutrýst (Fiskideyði, F) Gýtingarstovnur 17
18 Veiðusetningur Ein veiðusetningur Harvest Control Rule, HCR er eisini settur út í kortið. Stovnsstøddin, sum í longdini gevur størstu varandi veiðuna, verður nevnd B MSY. Hon er sera trupul at meta neyvt, men eydnast tað at regulera veiðutrýstið til F MSY (í miðal), so fer stovnurin at sveiggja nakað um eitt miðalvirði, ið ikki er neyðugt at kenna neyvt. Tó er alla tíðina neyðugt at fylgja væl við stovnsstøddini. Skuldi tað so hent, at stovnurin, t.d. vegna broytt náttúruviðurskifti, minkar ov nógv, hóast veiðutrýstið í miðal liggur um F MSY, so er neyðugt fyribils at minka veiðutrýstið, til tess at forða fyri, at gýtingarstovnurin gerst ov lítil. Í veiðusetninginum, sum sæst á myndini, er víst ein stovnsstødd, B MSY-trigger, ið sum oftast fer at vera umleið B pa í PA-ráðgevingini. Fer gýtingarstovnurin niður um hetta virðið, skal veiðutrýstið minkast, og tess longur hann fer niður um virðið, tess meira skal veiðutrýstið minkast. Tann brotna farstrikan á myndini vísir, tá gýtingarstovnurin verður heilt lítil. Hvat tá skal henda, er ikki heilt vist, men uttan iva Veiðutrýst, F F(MSY) B(MSY-trigger) verður ráðgevingin tá at gevast við fiskiskapinum. Ein slíkur veiðusetning ur vil fyri t.d. Føroyar merkja, at tað bert í heilt serligum førum verður mælt til heilt at steðga fiskiskapi. Gýtingarstovnur, B Faldari um nýggja rannsóknarskipið Í mai 2011 gjørdi Havstovan ein fald ara, sum í stuttum lýs ir verkætlanina Nýtt havrannsóknarskip. Faldarin lýsir uppgávurnar hjá einum rannsóknarskipi, orsøkirnar til at tørvur er á slíkum skipi, og hví skipið er sniðgivið sum tað er. Tekn ingar eru av hvørjum dekki sær og av skipinum sum heild. Harafturat verða Magnus Heinason og nýggja havrannsóknarskipið sammett við onnur havrannsóknarskip í mun til stødd og kapasitet. Faldarin sæst á 18
19 Verklagslóg um nýtt havrannsóknarskip Leon Smith verkfrøðingur SKIPAVERKÆTLAN: Løgtingið hevur við breiðum meiriluta samtykt, at Magnus Heinason skal skiftast út við nýtt havrannsóknarskip, sum ætlandi verður liðugt í Ætlanin hevur verið í umbúnað leingi, tí Magnus Heinason er gamal og niður slitin. Nú skal ætlan in fremj ast í verki, hevur Løgtingið samtykt. Gongdin í málinum 23. mai 2011 legði Fiskimálaráðið verklagslógina um nýtt havrannsóknarskip fyri Løgtingið. Tá málið kom til 1. viðgerð 25. mai, var breið semja um at skifta Byggiverkætlanin Magnus Heinason út við eitt nýtt havrannsóknarskip. Málið varð beint í fíggj ar nevndina, sum 27. mai lat álit úr hond um. Ein samd fíggjarnevnd mælti Løgtinginum til at sam tykkja uppskotið. 30. mai kom málið til 2. viðgerð og var sent bein leiðis víðari til 3. viðgerð. Løg tingið víkti hetta kvøld ið frá Ár Játtan mió. kr mió. kr mió. kr mió. kr Tils. 200 mió. kr Tíðarætlan Tíðliga í 2012: Útboð sent til skipa smiðj ur Síðst í 2012: Síðst í 2014: Kjølurin verð ur strekt ur Nýggja havrannsóknarskipið verður latið landinum Fyri Havstovuna er eitt nýtt havrannsóknarskip byrjanin til eitt nýtt tíðarskeið øllum tíðar freist um og 3. viðgerð av málinum var tíðliga týsmorgunin tann 31. mai. Kl varð uppskotið samtykt við 25 atkvøðum fyri, tveimum ímóti og ongari blankari. Havstovan fegnast Havstovan fegnast um, at løgtingið sær tað neyð uga í at byggja eitt nýtt havrannsóknarskip, soleiðis at góðar og neyðugar kanningar av okk ara tilfeingi í havinum framhaldandi kunnu gerast. Magnus Heinason er gamal og tørvar støðugt ábøtur. Hóast skipið ongantíð var ætlað at virka sum havrannsóknarskip, hevur tað gjøgn um árini verið álitið hjá Havstovu ni, tá ið umræður at savna saman vitan um fiskastovnar og havumhvørvi. Fyri Havstovuna er eitt nýtt havrann sóknarskip byrjanin til eitt nýtt tíðarskeið, og fer skipið at tryggja og betra tað framhaldandi vísindaliga arbeiðið á havleiðunum við Føroyar. 19
20 Nýggj uppsjóvardeild sett á stovn Jan Arge Jacobsen fiskifrøðingur RANNSÓKNIR: Samstundis sum uppsjóvarstovnarnir eru vaksnir í vavi í føroyskum øki, er týdningurin av teimum eisini vaksin munandi. Hetta hevur økt um krøvini til Havstovuna, sum eftir politiskum ynski hevur sett á stovn nýggja uppsjóvardeild. Nýggja uppsjóvardeildin á Hav stovu ni sá dagsins ljós 1. januar Starvsøkið, ið Jan Arge Jacob sen hevur varað av, er tó ikki nýtt. Fram til 2011 var tað partur av Fiski deildini, sum er ein av deildunum á Havstovuni. Nú hevur hetta økið so fingið sína egnu deild. Øktan týdning Arbeiðið við uppsjóvarfiski og teirra vist frøði er vorðið eitt av teimum týdningarmiklu arbeiðsøkjunum á Havstovuni. Í 80-unum fevndi tað einans um svartkjaft. Men miðskeiðis í 90- unum kom sild inn í fiskiskapin, umframt at svartkjafturin samstundis fekk størri týdning. Hetta hevur sjálvandi bæði broytt og økt um arbeiðið við uppsjóvarfiski á Havstovuni. Í seinastuni er so makrelur komin afturat og tað í rættiliga stór an mun. Áður varð føroyska makrelkvotan fiskað í septembur mánað í norska ella ES-partinum av Norðsjónum, men í dag verður alt fiskað inni hjá okkum sjálvum um summarið. Hetta setir størri krøv til Hav stov - u na á hes um øki. Stór ur tørv ur er á at menna vitan og ráðgeving við víkjandi uppsjóvarfiski. Serligt áherðsluøki Av tí at makrelurin er komin í so stór um nøgdum í føroyskt sjóøki, fer hann at mynda ein stóran part av arbeið i num á Havstovuni komandi tíðina. 20
21 Stórur tørvur er á at menna vitan og ráðgeving viðvíkjandi uppsjóvarfiski Starvsfólk á Uppsjóvardeildini, frá vinstru: Jan Arge Jacobsen, deildarleiðari, Jens Arni Thomassen, Høgni Debes, Poul Vestergaard og Gunnvør Joensen. Jan Arge Jacobsen, Jens Arni Thomassen og Høgni Debes byrjaðu á deildini í januar. Hini bæði í apríl. Høgni Debes er tó framhaldani knýttur at Umhvørvisdeildini, soleiðis at hann starvast hálva tíð á hvørjari deild. Ætlanin er at byrja nýggjar verkætlanir, serliga innan vistskipanina uppi í sjónum. Á tann hátt ber til at kanna, um stóru nøgdirnar av uppsjóvar fiski serliga makreli á virka lívið í sjónum. Eisini er ætlanin at kanna, í hvønn mun broytingar í umhvørvinum ávirka út breiðslu, ferðing og nøgd av uppsjóvarfiski. Hetta verður gjørt í tøttum Av tí at makrelurin er komin í so stórum nøgdum í føroyskt sjóøki, fer hann at mynda ein stóran part av arbeiðinum á Havstovuni komandi tíðina samstarvi við Umhvørvisdeildina á Havstovuni. Fimm fólk á deildini Umframt deildarleiðaran, Jan Arge Jacobsen, eru fýra fólk sett í starv. Talan er um tvey granskarastørv og tvey størv sum bio logassistentur. Umframt Uppsjóvardeildina eru tríggjar aðrar deildir á Havstovuni, Botnfiskadeild, Umhvørvisdeild og Tekniska deild. 21
