Id,urls,text,language
sev,https://www.sev.fo/roknskapur2019/heilsa-trygd-og-umhvorvi/ https://www.sev.fo/um-okkum/sev-folksins-ogn/sogan/ https://www.sev.fo/um-okkum/midlar-og-samskifti/webcasts/ https://www.sev.fo/um-okkum/midlar-og-samskifti/tidindi/grona-foroyska-elorkan-a-arktiskari-radstevnu/ https://www.sev.fo/um-okkum/grona-kosin/ ," . Tá seinni heimsbardagi var av, var av álvara farið at fyrireika vatnorkuætlanirnar í Vestmanna, og 1. oktober 1946 stovnaðu flestu kommunurnar á Streymoynni, Eysturoynni og Vágum interkommunala Elfelagið SEV. Í Eysturoy var Sjóvar kommuna ikki umboðað, og í Streymoynni høvdu Kvívíkar kommuna, Kollafjarðar kommuna og Tórshavnar kommuna einki umboð sent á stovnandi fundin.
Kvívík og Kollafjørður ætlaðu at gera sítt egna elverk í Leynum við vatnorku úr Leynarvatni. Tórshavnar kommuna vildi ikki vera við til at útbyggja vatnorkuna í felagsskapi við tær 19 kommunurnar, sum stovnaðu SEV, men vildi heldur byggja nýtt motorverk til sín sjálvs. Tórshavnar kommuna játtaði kortini at keypa streym frá SEV, um hon kundi fáa hann bíligari har.
Tær 19 kommunurnar, sum stovnaðu SEV vóru sostatt: Oyndarfjarðar kommuna, Fuglafjarðar kommuna, Leirvíkar kommuna, Gøtu kommuna, Nes kommuna, Sunda kommuna, Eiðis kommuna, Funnings kommuna, Haldórsvíkar kommuna, Saksunar kommuna, Hvalvíkar kommuna, Vestmanna kommuna, Kaldbaks kommuna, Tórshavnar uttanbýggja kommuna, Kirkjubøar kommuna, Sandavágs kommuna, Miðvágs kommuna, Sørvágs kommuna og Bíggjar kommuna.
Uppskot til lógir fyri felagið varð lagt fram á stovnandi fundinum. Í fyrstu grein stóð, at “SEV er eitt interkommunalt andeilsfelag. Tess endamál er at útbyggja kraftkeldur og fáa til vega elektriska megi til fólk, sum býr í Vágum, Streymoy og Eysturoy. Heimstað felagsins er Vestmanna”.
Ein umboðsnevnd og eitt stýri skuldu stjórna felagnum, og ein stjóri skuldi hava dagligu leiðsluna um hendi. Gunnar Dahl Olsen, sýslumaður og sóknarstýrisformaður í Vestmanna, varð valdur til fyrsta stýrisformann. Hann røkti hetta starv, til hann legði frá sær vegna aldur í 1975.
Fyrsti umboðsnevndarformaður var Jóan Pauli Gregersen, vinnulívsmaður, úr Syðrugøtu. Hann var umboðsnevndarformaður til 1963, tá hann boðaði frá, at hann ikki tók við aftur formanssessinum.
Felagið varð uppkallað SEV eftir Streymoy, Eysturoy og Vágoy. Harumframt var orðið sev eisini at finna í føroyska plantuheiminum. Gamalt var, at sevleggur var brúktur til veik í koluni, sum var vanlig ljóskelda, áðrenn peran varð uppfunnin. . Henda heimasíðan brúkar kennifílur
Vit brúka kennifílur fyri at kanna ferðsluna á heimasíðuni og fyri at gera tína uppliving so góða sum møguligt.
Neyðugar kennifílur tryggja, at heimasíðan riggar, sum hon skal. Vit hava eisini valfríar kennifílur, sum kunnu gera tína uppliving og upplivingina hjá øðrum betri.
Tú kanst altíð taka samtykkið aftur. Hetta gert tú við at trýsta á ímyndina niðast til vinstru á heimasíðuni. Les meira um kennifílur . Umleið 300-400 fólk lýddu á, meðan stjórin í SEV greiddi frá avbjóðingunum innan grøna elorku í Føroyum, sum ætlandi skal verða 100 prosent grøn í 2030
SEV borðreiddi við grønu kósini á arktisku ráðstevnuni, The Arctic Circle, í Reykjavík fyrrapartin, har Hákun Djurhuus, stjóri í SEV, umboðaði elfelagið saman við nevndarformanninum, Jákupi Suna Lauritsen. Stjórin í SEV var partur av eini longri framløgu úr Føroyum saman við Aksel V. Johannesen, løgmanni, og Sjúrði Skaale, fólkatingsmanni.
1.700 fólk eru á ráðstevnuni, og eini 300-400 av teimum lýddu á framløguna hjá løgmanni, føroyska fólkatingsmanninum og SEV-stjóranum.
Hákun Djurhuus greiddi frá grønu kósini hjá SEV, sum hevur til endamáls at gera Føroyar óheftar av olju í 2030, tá ætlanin er, at øll orka á landi skal koma frá elorku, sum stavar frá varandi orkukeldum – vatni, vindi, sjóvarfalli og sólorku.
Eisini greiddi SEV-stjórin frá avbjóðingunum í Føroyum at fáa eitt nú nógvan vind, ið er óstøðug orkukelda, inn á føroyska elnetið, sum liggur avbyrgt í Norðuratlantshavi. Føroyar hava ikki møguleika at binda í størri elnet og keypa elorku haðani, soleiðis sum Danmark t.d. kann keypa elorku úr Svøríki og Týsklandi. Sostatt noyðast Føroyar at hava sína egnu backup-skipan.
Føroyska avbjóðingin er í løtuni at fáa sum mest av óstøðuga vindinum til høldar, samstundis sum elveitingin er støðug, og tað skal m.a. gerast við nýggju battarískipanini í Húsahaga, ið skal javna óstøðuga vindin út á elnetið. Ein onnur avbjóðing hjá Føroyum í elorkuhøpi er, at ov lítið av vatni og vindi er um summarið, og tí verður arbeitt við loysnum, sum kunnu goyma vindorkuna í longri tíð – t.d. pumpuskipan og møguleikanum at gera vetni (brint) úr vatni.
Í báðum førum er talan um at brúka yvirskotsorkuna frá vindinum. Yvirskotsorkan frá vindinum kann brúkast til at pumpa vatn niðan aftur í byrgingarnar, eftir at tað er farið ígjøgnum turbinurnar, og vindorkan kann eisini brúkast til at framleiða vetni úr vatni, sum síðani kann nýtast eftir tørvi.
Íslendski forsetin Ólafur Ragnar Grimsson, sum m.a. vitjaði SEV á Føroyaferð síni í august, er við á arktisku ráðstevnuni. Aðrir leiðarar á The Arctic Circle eru t.d.: franski forsetin Francois Hollande, Prince Albert II úr Monaco, Dagur B. Eggertsson, borgarstjóri í Reykjavík og Dagfinn Høybråten, aðalskrivari í Norðurlendska Ráðharraráðnum.
The Arctic Circle hevur til endamáls at menna samstarvið í arktiska økinum við samrøðum og at seta framtíðina hjá Arktisk í altjóða miðdepilin. Ráðstevnan verður hildin í Hørpuni í Reykjavík. . 100 % burðardygg elorka á landi í 2030
Í 2014 setti SEV kósina, sum hevur til endamáls, at øll elorka á landi skal stava frá varandi orkukeldum í 2030, og síðan 2014 hevur SEV arbeitt miðvíst fram ímóti at røkka hesum máli.
Avbyrgda elskipanin í Føroyum er í sjálvum sær ein stór avbjóðing, tá ið talan er um at fáa so nógva grøna orku til vega sum gjørligt. Málið kann bert røkkast við nýhugsan og menning.
Battarískipanin í Húsahaga, sólorkulundin í Sumba, sjóvarfalsverkætlanin í Vestmannasundi eru onkur ítøkilig dømi um nýhugsan á elorkuøkinum í Føroyum.
Samstundis sum arbeitt verður av øllum alvi at finna loysnir við burðardyggum orkukeldum, samstarvar SEV við Setrið um slóðbrótandi ph.d.-verkætlan um, hvussu støðufestið kann tryggjast í elskipanini í einum avbyrgdum oyggjasamfelag, tá ið orkukeldurnar í stóran mun eru óstøðugar.
Í 2015 vann SEV náttúru- og umhvørvisvirðislønina hjá Norðurlandaráðnum fyri grønu kósina, vindmyllulundina í Húsahaga við nýmentu battarískipanini og nýggju stýrisskipanini. Sama ár vann SEV umhvørivsvirðislønina hjá Tórshavnar Kommunu.
Verkætlanir við grønari orku
Í strembanini eftir at náa málinum um 100 % burðardygga elframleiðslu á landi í 2030 hevur SEV sett sjøtil á fleiri áhugaverdar verkætlanir, sum eru liður í hesum arbeiði.
Á vindorkuøkinum verður arbeitt við vindmyllulundum í ávikavist Porkerishaganum og á Eiði, og harumframt eru tvær áhugaverdar royndarverkætlanir í gongd við ávikavist sjóvarfalsorku í Vestmannasundi og sólorku í Sumba. . ",Faroese
Tórshavnar kommuna,https://www.torshavn.fo/bustadur-og-bygging/orka-og-umhvorvi/oljutangi-soleidis-gert-tu/ https://www.torshavn.fo/tidindi/kanna-nyggja-og-spennandi-vinnu/ https://www.facebook.com/Torshavn/ ,"Oljutangi – soleiðis gert tú
Hevur tú ein gamlan oljutanga, sum er millum 20 og 50 ár, skalt tú vera greið yvir, at tangin er í vanda fyri at dálka bæði mold og vatn. Hendir hetta, kann tað gerast kostnaðarmikið.
Oljutangin skal tí takast úr nýtslu, áðrenn hann gerst ov gamal, soleiðis at bæði tú og kommunan sleppa undan einari kostnaðarmiklari umhvørvisdálking og upprudding. Ivast tú í framleiðsluárinum, eigur tú at fáa ein serfrøðing at kanna tangan og rørleiðingarnar. Um oljunýtslan hækkar munandi, skal kommunan fráboðast og orsøkin finnast.
Tú kanst lesa meira um lógarreglurnar í kunngerðini um fyribyrging av dálking frá oljutangum, sum tú finnur niðanfyri. Harafturat skalt tú fylgja føstum mannagongdum, tá tú tekur tín gamla oljutanga úr nýtslu.
Tú tilmeldar ella frámeldar tín oljutanga við at senda teldupost til torshavn@torshavn.fo.
Ætlar tú tær at keypa nýggjan oljutanga ella oljufýring, skalt tú minnast til, at hetta ber bert til, um tín ogn ikki er fevnd av eini íbindingarskyldu til fjarhita. Tú kanst kanna, um tú býrt á einum matrikkli við íbindingarskyldu til fjarhita við at skriva tín bústað og títt húsanummar í leititeigin niðanfyri.
Hevur tú ikki møguleika fyri at fáa fjarhita, mæla vit til, at tú fært tær eina aðra grøna orkuloysn. Ivast tú í, hvør orkuloysn hóskar best til tíni hús, kanst tú seta teg í samband við Orkuskiftið á Umhvørvisstovuni, sum er ráðgevandi myndugleikin í føroyskum orkuviðurskiftum. Ring á tel. 34 24 00, vitja heimasíðuna www.os.fo ella send ein teldupost til us@us.fo.
Løgtingslógarkunngerðin um fyribyrging av dálking frá oljutangum (logir.fo)
Soleiðis fært tú tær jarðhita
Soleiðis fært tú tær hitapumpu
Vilt tú burturbeina ein niðurgrivnan oljutanga, skal tangin tømast og gravast upp. Vanliga er tað ein VHS-fyritøka ella ein byggifyritøka, sum tekur sær av arbeiðinum.
Sum eigari skalt tú boða kommununi og veitaranum av orkuloysnini frá seinasta lagi 14 dagar áðrenn, tú tekur tangan fyribils ella endaliga úr nýtslu.
Eru tekin um leka ella oljudálking, skal tú boða kommununi frá. Kommunan skal somuleiðis sýna økið, áðrenn tú tippir holið aftur og beinir tangan burtur.
Í serligum førum ber til at søkja kommununa um undantaksloyvi til at lata tangan liggja undir jørð. Fært tú loyvi, skalt tú avrigga tangan. Tað vil siga, at tú ella til dømis IRF skulu botnsúgva tangan, tippa hann og byrgja væl fyri. Vit loyva bara undantøkum, um vit meta tað vera umhvørvisliga ráðiligt og rímiligt.
Vilt tú søkja um undantaksloyvi, skalt tú útfylla umsóknarblaðið um undantaksloyvi niðanfyri og senda tað í telduposti til torshavn@torshavn.fo. Minst til at viðmerkja ""Undantaksloyvi til oljutanga"" í evnisteigin.
Skal tangin hinvegin gravast upp og beinast burtur, skalt tú boða kommununi frá 14 dagar áðrenn, tú fyllir mold í aftur og beinir tangan burtur.
Umsókn um undantak frá at taka oljutanga upp
TÁ OLJUTANGIN SKAL GRAVAST UPP
- Hevur tú illgruna um oljuleka ella oljudálking, skal tú boða kommununi frá, so kommunan kann sýna tangan og útgrevsturin, áðrenn tú tippir holið aftur og beinir tangan burtur. Send ein teldupost til torshavn@torshavn.fo ella ring á tel. 30 20 10
- Tú frámeldar tangan við at senda ein teldupost til torshavn@torshavn.fo ella ringja á tel. 30 20 10
- Gev gætur at kanna við tínum tryggingarfelagi, hvørt tryggingin tekur við, um dálking vísir seg undir uppgrevstrinum
- Minst til at olja og vatn, sum inniheldur olju, skal ongantíð leiðast út í vegristir ella spillvatnsfrárensl, men skal latast brennistøðini á Hjalla ella IRF
UM OLJUTANGIN IKKI VERÐUR GRIVIN UPP
- Fyri at fáa loyvi til at avrigga tangan í staðin fyri at grava hann upp og beina hann burtur, skalt tú senda kommununi eina umsókn um undantaksloyvi. Í umsóknarskjalinum skal vera frágreiðing og grundgeving fyri, hví tú skalt fáa eitt undantaksloyvi. Tú skalt eisini upplýsa slag av oljutanga og annað
- Fært tú undantaksloyvi, skulu tangi og rørleiðing tømast, og tangin skal botnsúgvast, soleiðis at oljuleivdir ikki eru í tanganum
- Kommunan skal sýna tangan, áðrenn proppur verður settur fyri. Vit kunnu í fyrsta lagi sýna tangan 24 tímar eftir, at tangin er botnreinsaður
- Tá vit hava sýnað tangan, skalt tú fylla tangan við sandi
- Áfyllingartúturin á tanganum skal proppast við einari endamuffu undir jørð og áfyllingarstaðið takast burtur
- Minst til at olja og vatn, sum inniheldur olju, skal ongantíð leiðast út í vegristir ella spillvatnsfrárensl, men skal latast brennistøðini á Hjalla ella IRF
- Tú skalt frámelda tangan við at senda ein teldupost til torshavn@torshavn.fo. Frámeldingin skal annaðhvørt undirskrivast av grundeigaranum ella av viðkomandi, sum hevur ábyrgdina fyri avbyrgingini av tanganum
Ætlar tú tær at taka ein oljutanga úr nýtslu, sum stendur í tínum húsum ella uttan fyri tíni hús, skal tangin frámeldast og burturbeinast. Vanliga er tað ein VHS-fyritøka ella byggifyritøka, sum tekur sær av arbeiðinum.
TÁ TÚ BEINIR TANGAN BURTUR
- Tú skalt boða kommununi frá 14 dagar áðrenn. Tað gert tú við at senda ein teldupost til torshavn@torshavn.fo. Frámeldingin skal undirskrivast av grundeigaranum ella av viðkomandi, sum hevur ábyrgdina av niðurtøkuni
- Tangin skal tømast og reinsast, áðrenn tú beinir hann burtur
- IRF kann botnsúgva tangan móti gjaldi
- Minst til at olja og vatn, sum inniheldur olju, skal ongantíð leiðast út í vegristir ella spillvatnsfrárensl, men skal latast brennistøðini á Hjalla ella IRF
- Tangin skal latast inn á jarnplássinum á brennistøðini á Hjalla
Tú kanst bara seta nýggja oljufýring upp, um tú býrt í einum øki uttan skyldu til at knýta uppí fjarhitaskipanina.
Skriva tín bústað og títt húsanummar í leititeigin á kortinum niðanfyri fyri at síggja møguleikarnar í tínum øki. Er økið blátt, er tín grund er fevnd av íbindingarskyldu til fjarhita. Er økið reytt, er tín matrikkul fevndur av bæði íbindingarskyldu og nýtsluskyldu.
Í summum førum er krav, at tú fært góðkenning frá Tórshavnar kommunu, áðrenn tú setur oljutangan upp. Tangin skal tískil altíð meldast til í seinasta lagi tvær vikur, áðrenn tú setur hann upp. Tú meldar tangan til við at senda ein teldupost til torshavn@torshavn.fo.
Áðrenn tú setur nýggja oljutangan upp, skalt tú minnast til:
FYRI UTTANDURA TANGAR YVIR JØRÐ
- Tangar skulu altíð fráboðast og góðkennast av kommununi
- Allir uttandura tangar skulu vera sniðgóðkendir til uttandura brúk
- Allir tangar uttandura skulu standa í minsta lagi 2,5 metrar frá marki
- Serlig krøv eru til uppseting av uttandura tangum yvir jørð. Tú kanst lesa meira um hesi krøvini í faldaranum hjá Arbeiðs- og brunaeftirlitinum um uppseting av oljutangum
Vegleiðing til uppseting av oljutangum
FYRI TANGAR INNANDURA
- Tangar, sum eru sniðgóðkendir til innandura nýtslu, skulu bara setast upp inni
- Serlig krøv eru til brunatrygdina. Spyr tín veitara um vegleiðing, og kunna teg nærri í vegleiðingini hjá Arbeiðs- og brunaeftirlitinum um uppsetan av oljutangum
- Frástøðan millum tanga og heitar lutir, tól, oljufýring, skorstein, roykrør og tílíkt skal í minsta lagi vera 50 cm.
Vegleiðing til uppseting av oljutangum
FYRI UTTANDURA TANGAR AT LEGGJA Í JØRÐ
- Tú skalt boða kommununi frá 14 dagar, áðrenn tangin verður tyrvdur
- Jørðtangar skulu vera sniðgóðkendir til at grava niður. Góðkendir tangar lúka serlig krøv um byggihátt, styrki og verju móti tæring
- Minst til, at oljutangin skal takast uppaftur nøkur ár seinni, tá hann ikki skal brúkast longur. Legg ikki tún, asfalt, flísar, garð og annað omaná
- Ansa eftir, at kloakkrør, káplar ella leiðingar kunnu vera í jørðini
- Byggideildin í Tórshavnar kommunu kann hjálpa tær við at leita fram kloakktekningar og annað. Ring á tel. 30 20 10 ella send ein teldupost til torshavn@torshavn.fo. Skriva ""Umbøn um tekningar í samband við oljutanga"" í evnisteigin á teldupostinum og minst til at viðmerkja títt navn, telefonnummar og matrikkulnummar
Tá nýggi oljutangin er settur upp, skalt tú senda avrit av tangaváttanini til kommununa. Váttanin skal leggjast við tilmeldingarskjalinum. Váttanin frá veitaranum av tanganum er týdningarmikil, tí hon skjalprógvar slagið av tanga og aldurin á tanganum.
Allir oljutangar skulu harumframt hava merki ella spjaldur, sum vísa framleiðsluár og tangastødd.
Vegleiðing til uppseting av oljutangum
Livitíðin hjá einum oljutanga er tengd at framleiðsluárinum. Tangaváttanin skjalprógvar aldurin og livitíðina hjá tínum tanga, og tí skalt tú minnast til at fáa váttanina útflýggjaða frá tangaveitaranum.
Í talvuni niðanfyri sært tú livitíðina fyri ymsu tangasløgini.
Oljutangar hava vanliga eina livitíð á 20-40 ár; alt eftir slagi. Verður ein niðurgrivin tangi tikin úr nýtslu, skal hann tømast, gravast upp og burturbeinast. Oljutangar yvir jørð skulu tømast og latast inn á jarnplássinum á brennistøðini á Hjalla.
Ivast tú í, um tú hevur skjalprógv fyri tangaslagið og framleiðsluárið á tínum tanga, kanst tú spyrja oljufýrsteknikaran um hetta.
Sum grundeigari hevur tú fulla ábyrgd fyri, at tangin er lógligur, og at hann ikki er í vanda fyri at dálka umhvørvið.
Kanna um tú hevur eina trygging, sum fevnir um dálkingarskaða frá egnum oljutanga.
Les meira um mannagongdir og krøv til oljutangar í okkara kunningar- og vegleiðingartilfari niðanfyri.
Hevur tú spurningar, ert tú vælkomin at venda tær til kommununa. Ring til Snarskivuna ella send okkum ein teldupost til torshavn@torshavn.fo.
Filmur um oljutangar og oljulekar
Hvussu sleppur tú undan oljuleka og umhvørvidálking?
Vegleiðing til uppseting av oljutangum . Kanna nýggja og spennandi vinnu
Í farnu viku var kunnandi fundur millum Ráðgevandi Verkfrøðingar SMJ og Jóhan Mortensen sum stigtakara øðrumegin, og umboð fyri Tórshavnar kommunu hinumegin.
Kunnað varð um komandi føroysk størv innan offshore-vinnuna, alivinnuna, matvøruvinnuna, rúmdar- ella spacevinnu, størv í sambandi við menning í Arktis, og tænastur innan goymslur og bunkring og maritima tænastumiðstøð í Tórshavnar kommunu.
Eisini varð kunnað um komandi tørv innan flogvallartænastu, havvindmyllulund, rúmdargransking sum nátúrligan part av lestrarumhvørvinum, altjóða marghøll, langhyl og fótbóltshøll, og spennandi vitjanir í Føroyum av útlendskum stovnum, sum í framtíðini kunnu hava tørv á samstarvi við føroyingar.
Talan var bert um ein kunnandi fund í hesum umfari. Arbeitt verður víðari við nøkrum av málunum.
Á myndini síggjast frá vinstru: Doris Bjarkhamar, fulltrúi á stjórnarskrivstovuni, Heðin Mortensen, borgarstjóri, Kári Johansen, formaður í havnanevndini, Kristianna Winther Poulsen, forkvinna í vinnunevndini, Jóhan Mortensen, stigtakari, Petur Martin Glerfoss, deildarleiðari á SMJ og Árni Jacobsen, stjóri á SMJ. . Videoer
So er fyrsta skotið latið av fyri Langhylinum í Gundadali. Heðin Mortensen, borgarstjóri, og Annfinn Brekkstein, formaður í Mentanarnevnd Tórshavnar býráðs, loysa fyrsta skotið.
12
Nú kemur futtur í Reinsaríið Praktikknæmingarnir Maria Beder úr 9. flokki í Skúlanum við Løgmannabreyt og Jessica Cazabon Celibashi úr 9. flokki í Hoyvíkar skúla, hava verið og prátað við Boga Andreasen, dagligan leiðara á Reinsarínum.
5
Opslag
Stongt Norðuri á Heyggi týsdagin og mikudagin
Tey taka upp á Velbastað týsdagin og mikudagin til filmsrøðina Trom. Vegurin Norðuri á Heyggi, frá Norðuri á Trøð til undir Borgarháls, er stongdur fyri allari ferðslu:
Týsdagin frá kl. 08.30 til kl. 19.00...
Mikudagin frá kl. 12.00 til kl. 20.00
Se mere
Leið 6 koyrir eftir Ervavegnum í hesum tíðarskeiðinum. . ",Faroese
gransking,https://www.gransking.fo/fo/tilfeingi/tidindi/umhvorvi-vedurlag-og-orka-hogt-radfest-i-nordurlondum/ https://www.gransking.fo/fo/tilfeingi/tidindi/opid-hus-hja-nyggja-granskingarstovninum-sjokovanum/ http://www.gransking.fo/fo/tilfeingi/tidindi/vedurlagsbroytingar-og-arin-a-fornminni-og-mentanarumhvorvi-nordurlendskt-samstarv/ (link til flere links) https://www.gransking.fo/fo/leita/?s=arktis https://www.sjokovin.fo ,"Umhvørvi, veðurlag og orka - høgt raðfest í norðurlondum
Fríggjadagin 12. juni hittust norðurlendskir granskarar og vinnulívsfólk til kick-off-seminar fyri tað størstu norðurlendsku granskingar- og nýskapanar tiltakið nakrantíð.
Fundurin var samstundis byrjanin til topgranskingartiltakið (topforskningsinitiativ) fyri teir tríggir stovnarnar: Nordisk Energiforskning, Nordisk InnovationsCenter og Nordforsk í Oslo.
Rolf Annerberg, leiðari í styribólkinum fyri toppgranskignartiltakið, vísur á potentiali fyri og nyttuna av einum munadyggum norðurlendskum samstarvið innan hetta øki.
-Hetta er tað størsta granskingar- og nýskapanarskipanin nakrantíð í norðurlendskum høpi. Risastórir granskingarmøguleikar eru innan hetta øki, og tað er avgjørt nakað vit mugu arbeiða fyri at fáa at bera til, sigur Rolf Annenberg, í tíðindabrævi hjá norðurlandaráðnum.
Progamleiðslan, ið er leiðandi myndugleikin í toppgranskingartiltakinum, hevur ábyrgdina av øllum tiltakinum. Samlaða fíggingin til tiltakið er býtt í seks evnisøki:
1: Effektstudier og tilpasninger til klimaendringer
2: Klimaendringenes vekselvirkning med kryosfæren
3: Nanoteknologi og energieffektivitet
4: Integrering av storskalavindkraft
5: Holdbar bioenergi
6: Utskilling og lagring av karbondioksid
Til hvørt av hesum evnisøkjunum er ein faknevnd vald, sum hevur ábyrgdina lýsa útboð, at játta pening og at eftirmeta verkætlanirnar.
Les meir um toppgranskingartiltakið.
Les ein faldara um toppgranskingartiltakið . Opið hús hjá nýggja granskingarstovninum Sjókovanum
Í sambandi við, at privati granskingarstovnurin Sjókovin varð settur á stovn fyrr í ár, verður opið hús og framløgur í Bátasavninum í Leirvík nú mikudagin 17. juni kl. 14. Hetta boðar stovnurin frá í tíðindaskrivi.
Sjókovin er ein óheftur, privatur, ikki-vinnuligur granskingargrunnur, sum fimm føroyskar fyritøkur settu á stovn fyrr í ár. Høvuðsendamálið við grunninum er at stimbra burðardygga menning og nýskapan í fiski- og alivinnu við at veita vitanartænastur gjøgnum gransking og luttøku í altjóða verkætlanum. Eisini skal grunnurin virka sum samskiftisdepil fyri sjófeingisfyritøkur og aðrar áhugapartar.
- Tað er sera týdningarmikið fyri okkum, at hava eitt gott samstarv við vinnufyritøkur og aðrar áhugapartar her heima í Føroyum fyri at tryggja, at granskingin hjá okkum kann vera við til at skapa størri virðir fyri føroyska samfelagið. Starvsfólkini í Sjókovanum hava eitt sterkt netverk til granskingarstovnar úti í heimi og hava drúgvar royndir at arbeiða við verkætlanum innan umsiting av fiski- og alivinnu. Harumframt vita vit, at nógvar føroyskar fiski- , alifyritøkur og teirra undirveitarar, eru sera frammaliga innan teirra øki. Sjókovin er tí í einari sterkari støðu til at bera viðkomandi vitan úr altjóða granskingarumhvørvinum til Føroya, og samstundis - ígjøgnum góða samstarvið við føroyskt vinnulív - bera vitan úr Føroyum út í heim, sigur Unn Laksá, ið stendur á odda fyri Sjókovanum.
Umframt at luttaka í fleiri størri, altjóða verkætlanum innan umsiting av havtilfeingi, granskar Sjókovin í løtuni eisini ávirkanina av Covid-19 á føroyska fiski- og alivinnu og
avleiðingarnar fyri føroyska búskapin. Verkætlanin er fíggjað av granskingarráðnum, og endaliga frágreiðingin verður løgd fram fyrst í oktober.
- Vit vóna, at vit ígjøgnum okkara granskingarvirksemi og samskifti av úrslitunum, kunnu gera okkara íkast til at menna vitanina um sjófeingisvinnur og soleiðis eisini ríka kjakið í almenna rúminum, sigur Unn Laksá.
Tiltakið mikudagin er alment, men orsakað av avmarkaðari atgongd krevst tilmelding. Til ber at lesa meira um tiltakið og skráseta seg her . Veðurlagsbroytingar og árin á fornminni og mentanarumhvørvi - Norðurlendskt samstarv
Sambandið millum veðurlagsbroytingar og árin teirra á fornminni og mentanarumhvørvi í Norðurlondum er sett á dagsskrá.
Økjandi hiti, slavnari veður og hækkandi sjógvur kunnu fara at ávirka fornminni og mentanarumhvørvi tvørtur um landamørk. Árinini av veðurlagsbroytingunum á mentanarumhvørvi hava fingið størri ans bæði í Norðurlondum og í altjóða høpi.
Hetta er orsøkin til at Norðurlanda Ráðharraráðið fíggjar samstarv millum fornminnafyrisitingarnar í norðurlondum: Íslandi, Føroyum, Grønlandi, Danmark, Finlandi, Svøríki og Noregi. Verkætlanin skal fremja og økja samskifti um kunnleika og royndir millum norðurlond.
Eitt úrslit av fráboðaðu veðurlagsbroytingunum er, at permafrost bránar, og hetta hóttir mentanarminni á arktisku leiðunum. Eitt annað úrslit av heitari og slævnari veðurlagi er økti vandin fyri soppavøkstri og rotskaðum í timburbygningum.
Hinvegin eru nógv mentanarminni, ið hava tolað skiftandi og ógvusligar veðurlagsumstøður í mong hundrað ár. Tí fer verkætlanin at lýsa vitanina um veðurlagstillagingar, hesi mentaminni umboða.
Hóast fleiri av veðurlagsavbjóðingunum eru tær somu, eru umstøðurnar kortini ymiskar í teim ymisku londunum. Norðurlendska verkætlanarsamstarvið skal savna ítøkiliga vitan um, hvussu veðurlagsbroytingar kunnu væntast at ávirka mentanararvin í teim ymisku londunum, hvørjar avleiðingarnar fara at verða fyri fornminnafyrisitingarnar og meta um møguleikar fyri verjutiltøkum í norðurlondum.
